Timestamp,Student Question,Response,Source
2024-05-25 09:53:45.114522,can you tell me about atomic habits book,"Atomic Habits is a self-help book by James Clear that focuses on the power of small, incremental changes in building lasting habits. It emphasizes the importance of creating systems and routines that make it easier to adopt positive habits and break negative ones. The book provides practical strategies for setting goals, tracking progress, and overcoming obstacles. By breaking down habits into their smallest components, Atomic Habits empowers readers to make gradual improvements that accumulate over time, leading to significant transformations in their lives.",Google Gemini
2024-05-25 10:09:20.937931,I want to know about atomic habits,"Atomic habits are small, incremental changes that, over time, can lead to significant improvements. They are based on the idea that by making tiny changes to our daily routines, we can gradually transform our lives. Atomic habits are often easy to implement and require minimal effort, making them a sustainable way to achieve our goals. By focusing on one small habit at a time, we can avoid feeling overwhelmed and increase our chances of success.",Google Gemini
2024-05-25 10:10:05.643105,how can I improve my personal well being,"To enhance personal well-being, prioritize self-care practices such as regular exercise, a balanced diet, and adequate sleep. Cultivate meaningful relationships, engage in activities that bring joy, and practice mindfulness to reduce stress. Set realistic goals, celebrate achievements, and seek support when needed. By nurturing both physical and mental health, you can create a fulfilling and balanced life.",Google Gemini
2024-05-25 10:55:07.571955,I want to know about machine translation,"Machine translation (MT) is a technology that automatically translates text from one language to another. It uses computer algorithms to analyze the source text, identify its meaning, and generate a translation in the target language. MT systems are trained on large datasets of parallel texts, which are pairs of documents in different languages that have the same meaning. By learning from these datasets, MT systems can develop the ability to translate text with varying degrees of accuracy and fluency.",Google Gemini
2024-05-25 10:55:54.949293,how it can be used in Indian context,"**Indian Context:**

The Indian context is characterized by a diverse population, cultural heritage, and economic disparities. To address these complexities, various approaches can be tailored to suit the specific needs of the country. For instance, leveraging technology for financial inclusion can empower marginalized communities, while promoting sustainable agriculture practices can enhance food security and environmental conservation. Additionally, fostering social entrepreneurship can create innovative solutions to address societal challenges, such as healthcare and education.",Google Gemini
